{
  "treatment": "monolith_sol_medium_opencode",
  "status": "complete",
  "cloudflare_url": "https://shootemup-bench-monolith-sol-medium-opencode-neon.pages.dev",
  "cloudflare_project": "shootemup-bench-monolith-sol-medium-opencode-neon",
  "supabase_url": "https://lyyyxbxacrxqflxmtlqq.supabase.co",
  "supabase_project_ref": "lyyyxbxacrxqflxmtlqq",
  "supabase_public_key": "sb_publishable_cgwOqQeY8eHfwsHYrnepJw_5kfrA-sD",
  "verification": {
    "production_http_status": 200,
    "leaderboard_round_trip": true,
    "tests_passed": true
  },
  "notes": "Production Pages deployment uses the shared benchmark Supabase project and the monolith_sol_medium_opencode leaderboard partition."
}
