{
  "treatment": "monolith_luna_high_opencode",
  "status": "complete",
  "cloudflare_url": "https://shootemup-bench-monolith-luna-high-opencode-neon-barrage.pages.dev",
  "cloudflare_project": "shootemup-bench-monolith-luna-high-opencode-neon-barrage",
  "supabase_url": "https://hfzeeoecsynkfyyjnekj.supabase.co",
  "supabase_project_ref": "hfzeeoecsynkfyyjnekj",
  "supabase_public_key": "eyJhbGciOiJIUzI1NiIsInR5cCI6IkpXVCJ9.eyJpc3MiOiJzdXBhYmFzZSIsInJlZiI6ImhmemVlb2Vjc3lua2Z5ZWpuZWtqIiwicm9sZSI6ImFub24iLCJpYXQiOjE3ODU5ODE5MzQsImV4cCI6MjEwMTU1NzkzNH0.UWanZgHM4SmffJdKh-io2CCf787AIdIXihvaP7LuLhQ",
  "verification": {
    "production_http_status": 200,
    "leaderboard_round_trip": true,
    "tests_passed": true
  },
  "notes": "Canvas shooter deployed to Cloudflare Pages; Supabase scores table uses anon-only SELECT/INSERT RLS with database validation."
}
